Lead,x1,Code,x2,Name,x3,Short description,x4,Source of tag,x5,Note,Trail
{ 50829,", new TiffTagInfo {IdInteger =",50829,", IdString = """,ActiveArea,""", ShortDescription = """,Defines the active (non-masked) pixels of the sensor. Used in Raw IFD of DNG files.,""" , SourceOfTag = "" ",,""" , Note = """,,""" } },"
{ 50830,", new TiffTagInfo {IdInteger =",50830,", IdString = """,MaskedAreas,""", ShortDescription = ""","List of non-overlapping rectangle coordinates of fully masked pixels, which can optimally be used by DNG readers to measure the black encoding level. Used in Raw IFD of DNG files.",""" , SourceOfTag = "" ",,""" , Note = """,,""" } },"
{ 50831,", new TiffTagInfo {IdInteger =",50831,", IdString = """,AsShotICCProfile,""", ShortDescription = ""","Contains ICC profile that, in conjunction with the AsShotPreProfileMatrix tag, specifies a default color rendering from camera color space coordinates (linear reference values) into the ICC profile connection space. Used in IFD 0 of DNG files.",""" , SourceOfTag = "" ",,""" , Note = """,,""" } },"
{ 50832,", new TiffTagInfo {IdInteger =",50832,", IdString = """,AsShotPreProfileMatrix,""", ShortDescription = """,Specifies a matrix that should be applied to the camera color space coordinates before processing the values through the ICC profile specified in the AsShotICCProfile tag. Used in IFD 0 of DNG files.,""" , SourceOfTag = "" ",,""" , Note = """,,""" } },"
{ 50833,", new TiffTagInfo {IdInteger =",50833,", IdString = """,CurrentICCProfile,""", ShortDescription = """,The CurrentICCProfile and CurrentPreProfileMatrix tags have the same purpose and usage as,""" , SourceOfTag = "" ",,""" , Note = """,,""" } },"
{ 50834,", new TiffTagInfo {IdInteger =",50834,", IdString = """,CurrentPreProfileMatrix,""", ShortDescription = """,The CurrentICCProfile and CurrentPreProfileMatrix tags have the same purpose and usage as,""" , SourceOfTag = "" ",,""" , Note = """,,""" } },"
{ 50879,", new TiffTagInfo {IdInteger =",50879,", IdString = """,ColorimetricReference,""", ShortDescription = ""","The DNG color model documents a transform between camera colors and CIE XYZ values. This tag describes the colorimetric reference for the CIE XYZ values. 0 = The XYZ values are scene-referred. 1 = The XYZ values are output-referred, using the ICC profile perceptual dynamic range. Used in IFD 0 of DNG files.",""" , SourceOfTag = "" ",,""" , Note = """,,""" } },"
{ 50931,", new TiffTagInfo {IdInteger =",50931,", IdString = """,CameraCalibrationSignature,""", ShortDescription = """,A UTF-8 encoded string associated with the CameraCalibration1 and CameraCalibration2 tags. Used in IFD 0 of DNG files.,""" , SourceOfTag = "" ",,""" , Note = """,,""" } },"
{ 50932,", new TiffTagInfo {IdInteger =",50932,", IdString = """,ProfileCalibrationSignature,""", ShortDescription = """,A UTF-8 encoded string associated with the camera profile tags. Used in IFD 0 or CameraProfile IFD of DNG files.,""" , SourceOfTag = "" ",,""" , Note = """,,""" } },"
{ 50933,", new TiffTagInfo {IdInteger =",50933,", IdString = """,ExtraCameraProfiles,""", ShortDescription = ""","A list of file offsets to extra Camera Profile IFDs. The format of a camera profile begins with a 16-bit byte order mark (MM or II) followed by a 16-bit ""magic"" number equal to 0x4352 (CR), a 32-bit IFD offset, and then a standard TIFF format IFD. Used in IFD 0 of DNG files.",""" , SourceOfTag = "" ",,""" , Note = """,,""" } },"
{ 50935,", new TiffTagInfo {IdInteger =",50935,", IdString = """,NoiseReductionApplied,""", ShortDescription = ""","Indicates how much noise reduction has been applied to the raw data on a scale of 0.0 to 1.0. A 0.0 value indicates that no noise reduction has been applied. A 1.0 value indicates that the ""ideal"" amount of noise reduction has been applied, i.e. that the DNG reader should not apply additional noise reduction by default. A value of 0/0 indicates that this parameter is unknown. Used in Raw IFD of DNG files.",""" , SourceOfTag = "" ",,""" , Note = """,,""" } },"
{ 50936,", new TiffTagInfo {IdInteger =",50936,", IdString = """,ProfileName,""", ShortDescription = """,A UTF-8 encoded string containing the name of the camera profile. Used in IFD 0 or Camera Profile IFD of DNG files.,""" , SourceOfTag = "" ",,""" , Note = """,,""" } },"
{ 50937,", new TiffTagInfo {IdInteger =",50937,", IdString = """,ProfileHueSatMapDims,""", ShortDescription = """,Specifies the number of input samples in each dimension of the hue/saturation/value mapping tables. The data for these tables are stored in ProfileHueSatMapData1 and ProfileHueSatMapData2 tags. Allowed values include the following: HueDivisions >= 1; SaturationDivisions >= 2; ValueDivisions >=1. Used in IFD 0 or Camera Profile IFD of DNG files.,""" , SourceOfTag = "" ",,""" , Note = """,,""" } },"
{ 50938,", new TiffTagInfo {IdInteger =",50938,", IdString = """,ProfileHueSatMapData1,""", ShortDescription = """,Contains the data for the first hue/saturation/value mapping table. Each entry of the table contains three 32-bit IEEE floating-point values. The first entry is hue shift in degrees; the second entry is saturation scale factor; and the third entry is a value scale factor. Used in IFD 0 or Camera Profile IFD of DNG files.,""" , SourceOfTag = "" ",,""" , Note = """,,""" } },"
{ 50939,", new TiffTagInfo {IdInteger =",50939,", IdString = """,ProfileHueSatMapData2,""", ShortDescription = """,Contains the data for the second hue/saturation/value mapping table. Each entry of the table contains three 32-bit IEEE floating-point values. The first entry is hue shift in degrees; the second entry is saturation scale factor; and the third entry is a value scale factor. Used in IFD 0 or Camera Profile IFD of DNG files.,""" , SourceOfTag = "" ",,""" , Note = """,,""" } },"
{ 50940,", new TiffTagInfo {IdInteger =",50940,", IdString = """,ProfileToneCurve,""", ShortDescription = ""","Contains a default tone curve that can be applied while processing the image as a starting point for user adjustments. The curve is specified as a list of 32-bit IEEE floating-point value pairs in linear gamma. Each sample has an input value in the range of 0.0 to 1.0, and an output value in the range of 0.0 to 1.0. The first sample is required to be (0.0, 0.0), and the last sample is required to be (1.0, 1.0). Interpolated the curve using a cubic spline. Used in IFD 0 or Camera Profile IFD of DNG files.",""" , SourceOfTag = "" ",,""" , Note = """,,""" } },"
{ 50941,", new TiffTagInfo {IdInteger =",50941,", IdString = """,ProfileEmbedPolicy,""", ShortDescription = """,Contains information about the usage rules for the associated camera profile. The valid values and meanings are: 0 = ΓÇ£allow copyingΓÇ¥; 1 = ΓÇ£embed if usedΓÇ¥; 2 = ΓÇ£embed neverΓÇ¥; and 3 = ΓÇ£no restrictionsΓÇ¥. Used in IFD 0 or Camera Profile IFD of DNG files.,""" , SourceOfTag = "" ",,""" , Note = """,,""" } },"
{ 50942,", new TiffTagInfo {IdInteger =",50942,", IdString = """,ProfileCopyright,""", ShortDescription = """,Contains information about the usage rules for the associated camera profile. The valid values and meanings are: 0 = ΓÇ£allow copyingΓÇ¥; 1 = ΓÇ£embed if usedΓÇ¥; 2 = ΓÇ£embed neverΓÇ¥; and 3 = ΓÇ£no restrictionsΓÇ¥. Used in IFD 0 or Camera Profile IFD of DNG files.,""" , SourceOfTag = "" ",,""" , Note = """,,""" } },"
{ 50964,", new TiffTagInfo {IdInteger =",50964,", IdString = """,ForwardMatrix1,""", ShortDescription = """,Defines a matrix that maps white balanced camera colors to XYZ D50 colors. Used in IFD 0 or Camera Profile IFD of DNG files.,""" , SourceOfTag = "" ",,""" , Note = """,,""" } },"
{ 50965,", new TiffTagInfo {IdInteger =",50965,", IdString = """,ForwardMatrix2,""", ShortDescription = """,Defines a matrix that maps white balanced camera colors to XYZ D50 colors. Used in IFD 0 or Camera Profile IFD of DNG files.,""" , SourceOfTag = "" ",,""" , Note = """,,""" } },"
{ 50966,", new TiffTagInfo {IdInteger =",50966,", IdString = """,PreviewApplicationName,""", ShortDescription = """,A UTF-8 encoded string containing the name of the application that created the preview stored in the IFD. Used in Preview IFD of DNG files.,""" , SourceOfTag = "" ",,""" , Note = """,,""" } },"
{ 50967,", new TiffTagInfo {IdInteger =",50967,", IdString = """,PreviewApplicationVersion,""", ShortDescription = """,A UTF-8 encoded string containing the version number of the application that created the preview stored in the IFD. Used in Preview IFD of DNG files.,""" , SourceOfTag = "" ",,""" , Note = """,,""" } },"
{ 50968,", new TiffTagInfo {IdInteger =",50968,", IdString = """,PreviewSettingsName,""", ShortDescription = ""","A UTF-8 encoded string containing the name of the conversion settings (for example, snapshot name) used for the preview stored in the IFD. Used in Preview IFD of DNG files.",""" , SourceOfTag = "" ",,""" , Note = """,,""" } },"
{ 50969,", new TiffTagInfo {IdInteger =",50969,", IdString = """,PreviewSettingsDigest,""", ShortDescription = ""","A unique ID of the conversion settings (for example, MD5 digest) used to render the preview stored in the IFD. Used in Preview IFD of DNG files.",""" , SourceOfTag = "" ",,""" , Note = """,,""" } },"
{ 50970,", new TiffTagInfo {IdInteger =",50970,", IdString = """,PreviewColorSpace,""", ShortDescription = """,This tag specifies the color space in which the rendered preview in this IFD is stored. The valid values include: 0 = Unknown; 1 = Gray Gamma 2.2; 2 = sRGB; 3 = Adobe RGB; and 4 = ProPhoto RGB. Used in Preview IFD of DNG files.,""" , SourceOfTag = "" ",,""" , Note = """,,""" } },"
{ 50971,", new TiffTagInfo {IdInteger =",50971,", IdString = """,PreviewDateTime,""", ShortDescription = ""","This tag is an ASCII string containing the name of the date/time at which the preview stored in the IFD was rendered, encoded using ISO 8601 format. Used in Preview IFD of DNG files.",""" , SourceOfTag = "" ",,""" , Note = """,,""" } },"
{ 50972,", new TiffTagInfo {IdInteger =",50972,", IdString = """,RawImageDigest,""", ShortDescription = ""","MD5 digest of the raw image data. All pixels in the image are processed in row-scan order. Each pixel is zero padded to 16 or 32 bits deep (16-bit for data less than or equal to 16 bits deep, 32-bit otherwise). The data is processed in little-endian byte order. Used in IFD 0 of DNG files.",""" , SourceOfTag = "" ",,""" , Note = """,,""" } },"
{ 50973,", new TiffTagInfo {IdInteger =",50973,", IdString = """,OriginalRawFileDigest,""", ShortDescription = """,MD5 digest of the data stored in the OriginalRawFileData tag. Used in IFD 0 of DNG files.,""" , SourceOfTag = "" ",,""" , Note = """,,""" } },"
{ 50974,", new TiffTagInfo {IdInteger =",50974,", IdString = """,SubTileBlockSize,""", ShortDescription = ""","Normally, pixels within a tile are stored in simple row-scan order. This tag specifies that the pixels within a tile should be grouped first into rectangular blocks of the specified size. These blocks are stored in row-scan order. Within each block, the pixels are stored in row-scan order. Used in Raw IFD of DNG files.",""" , SourceOfTag = "" ",,""" , Note = """,,""" } },"
{ 50975,", new TiffTagInfo {IdInteger =",50975,", IdString = """,RowInterleaveFactor,""", ShortDescription = """,Specifies that rows of the image are stored in interleaved order. The value of the tag specifies the number of interleaved fields. Used in Raw IFD of DNG files.,""" , SourceOfTag = "" ",,""" , Note = """,,""" } },"
{ 50981,", new TiffTagInfo {IdInteger =",50981,", IdString = """,ProfileLookTableDims,""", ShortDescription = ""","Specifies the number of input samples in each dimension of a default ""look"" table. The data for this table is stored in the ProfileLookTableData tag. Allowed values include: HueDivisions >= 1; SaturationDivisions >= 2; and ValueDivisions >= 1. Used in IFD 0 or Camera Profile IFD of DNG files.",""" , SourceOfTag = "" ",,""" , Note = """,,""" } },"
{ 50982,", new TiffTagInfo {IdInteger =",50982,", IdString = """,ProfileLookTableData,""", ShortDescription = ""","Default ""look"" table that can be applied while processing the image as a starting point for user adjustment. This table uses the same format as the tables stored in the ProfileHueSatMapData1 and ProfileHueSatMapData2 tags, and is applied in the same color space. However, it should be applied later in the processing pipe, after any exposure compensation and/or fill light stages, but before any tone curve stage. Each entry of the table contains three 32-bit IEEE floating-point values. The first entry is hue shift in degrees, the second entry is a saturation scale factor, and the third entry is a value scale factor. Used in IFD 0 or Camera Profile IFD of DNG files.",""" , SourceOfTag = "" ",,""" , Note = """,,""" } },"
{ 51008,", new TiffTagInfo {IdInteger =",51008,", IdString = """,OpcodeList1,""", ShortDescription = ""","Specifies the list of opcodes (image processing operation codes) that should be applied to the raw image, as read directly from the file. Used in Raw IFD of DNG files.",""" , SourceOfTag = "" ",,""" , Note = """,,""" } },"
{ 51009,", new TiffTagInfo {IdInteger =",51009,", IdString = """,OpcodeList2,""", ShortDescription = ""","Specifies the list of opcodes (image processing operation codes) that should be applied to the raw image, just after it has been mapped to linear reference values. Used in Raw IFD of DNG files.",""" , SourceOfTag = "" ",,""" , Note = """,,""" } },"
{ 51022,", new TiffTagInfo {IdInteger =",51022,", IdString = """,OpcodeList3,""", ShortDescription = ""","Specifies the list of opcodes (image processing operation codes) that should be applied to the raw image, just after it has been demosaiced. Used in Raw IFD of DNG files.",""" , SourceOfTag = "" ",,""" , Note = """,,""" } },"
{ 51041,", new TiffTagInfo {IdInteger =",51041,", IdString = """,NoiseProfile,""", ShortDescription = ""","Describes the amount of noise in a raw image; models the amount of signal-dependent photon (shot) noise and signal-independent sensor readout noise, two common sources of noise in raw images. Used in Raw IFD of DNG files.",""" , SourceOfTag = "" ",,""" , Note = """,,""" } },"
{ 51089,", new TiffTagInfo {IdInteger =",51089,", IdString = """,OriginalDefaultFinalSize,""", ShortDescription = ""","If this file is a proxy for a larger original DNG file, this tag specifics the default final size of the larger original file from which this proxy was generated. The default value for this tag is default final size of the current DNG file, which is DefaultCropSize * DefaultScale.",""" , SourceOfTag = "" ","DNG spec (1.4, 2012), p. 74",""" , Note = """, ,""" } },"
{ 51090,", new TiffTagInfo {IdInteger =",51090,", IdString = """,OriginalBestQualityFinalSize,""", ShortDescription = ""","If this file is a proxy for a larger original DNG file, this tag specifics the best quality final size of the larger original file from which this proxy was generated. The default value for this tag is the OriginalDefaultFinalSize, if specified. Otherwise the default value for this tag is the best quality size of the current DNG file, which is DefaultCropSize * DefaultScale * BestQualityScale.",""" , SourceOfTag = "" ","DNG spec (1.4, 2012), p. 75",""" , Note = """, ,""" } },"
{ 51091,", new TiffTagInfo {IdInteger =",51091,", IdString = """,OriginalDefaultCropSize,""", ShortDescription = ""","If this file is a proxy for a larger original DNG file, this tag specifics the DefaultCropSize of the larger original file from which this proxy was generated. The default value for this tag is the OriginalDefaultFinalSize, if specified. Otherwise, the default value for this tag is the DefaultCropSize of the current DNG file.",""" , SourceOfTag = "" ","DNG spec (1.4, 2012), p. 75",""" , Note = """, ,""" } },"
{ 51107,", new TiffTagInfo {IdInteger =",51107,", IdString = """,ProfileHueSatMapEncoding,""", ShortDescription = ""","Provides a way for color profiles to specify how indexing into a 3D HueSatMap is performed during raw conversion. This tag is not applicable to 2.5D HueSatMap tables (i.e., where the Value dimension is 1). The currently defined values are: 0 = Linear encoding (method described in DNG spec); 1 = sRGB encoding (method described in DNG spec).",""" , SourceOfTag = "" ","DNG spec (1.4, 2012), p. 73",""" , Note = """, ,""" } },"
{ 51108,", new TiffTagInfo {IdInteger =",51108,", IdString = """,ProfileLookTableEncoding,""", ShortDescription = ""","Provides a way for color profiles to specify how indexing into a 3D LookTable is performed during raw conversion. This tag is not applicable to a 2.5D LookTable (i.e., where the Value dimension is 1). The currently defined values are: 0 = Linear encoding (method described in DNG spec); 1 = sRGB encoding (method described in DNG spec).",""" , SourceOfTag = "" ","DNG spec (1.4, 2012), p. 72-3",""" , Note = """, ,""" } },"
{ 51109,", new TiffTagInfo {IdInteger =",51109,", IdString = """,BaselineExposureOffset,""", ShortDescription = ""","Provides a way for color profiles to increase or decrease exposure during raw conversion. BaselineExposureOffset specifies the amount (in EV units) to add to th e BaselineExposure tag during image rendering. For example, if the BaselineExposure value fo r a given camera model is +0.3, and the BaselineExposureOffset value for a given camera profile used to render an image for that camera model is -0.7, then th e actual default exposure value used during rendering will be +0.3 - 0.7 = -0.4.",""" , SourceOfTag = "" ","DNG spec (1.4, 2012), p. 71",""" , Note = """, ,""" } },"
{ 51110,", new TiffTagInfo {IdInteger =",51110,", IdString = """,DefaultBlackRender,""", ShortDescription = ""","This optional tag in a color profile provides a hint to the raw converter regarding how to handle the black point (e.g., flare subtraction) during rendering. The currently defined values are: 0 = Auto; 1 = None. If set to Auto, the raw converter should perform black subtraction during rendering. The amount and method of black subtraction may be automatically determined and may be image-dependent. If set to None, the raw converter should not perform any black subtraction during rendering. This may be desirable when using color lookup tables (e.g., LookTable) or tone curves in camera profiles to perform a fixed, consistent level of black subtraction.",""" , SourceOfTag = "" ","DNG spec (1.4, 2012), p. 71",""" , Note = """, ,""" } },"
{ 51111,", new TiffTagInfo {IdInteger =",51111,", IdString = """,NewRawImageDigest,""", ShortDescription = ""","This tag is a modified MD5 digest of the raw image data. It has been updated from the algorithm used to compute the RawImageDigest tag be more multi-processor friendly, and to support lossy compression algorithms. The details of the algorithm used to compute this tag are documented in the Adobe DNG SDK source code.",""" , SourceOfTag = "" ","DNG spec (1.4, 2012), p. 76",""" , Note = """, ,""" } },"
{ 51112,", new TiffTagInfo {IdInteger =",51112,", IdString = """,RawToPreviewGain,""", ShortDescription = """,The gain (what number the sample values are multiplied by) between the main raw IFD and the preview IFD containing this tag.,""" , SourceOfTag = "" ","DNG spec (1.4, 2012), p. 76",""" , Note = """, ,""" } },"
{ 51125,", new TiffTagInfo {IdInteger =",51125,", IdString = """,DefaultUserCrop,""", ShortDescription = ""","Specifies a default user crop rectangle in relative coordinates. The values must satisfy: 0.0 <= top < bottom <= 1.0; 0.0 <= left < right <= 1.0. The default values of (top = 0, left = 0, bottom = 1, right = 1) correspond exactly to the default crop rectangle (as specified by the DefaultCropOrigin and DefaultCropSize tags).",""" , SourceOfTag = "" ","DNG spec (1.4, 2012), p. 70",""" , Note = """, ,""" } },"
,,,,,,,,,,,
,,,,,,,,,,,
